"GO.ID"	"GO.Term"	"zscore"
"GO:0032920"	"putrescine acetylation"	"2.587"
"GO:0046204"	"nor-spermidine metabolic process"	"2.587"
"GO:0048557"	"embryonic digestive tract morphogenesis"	"2.587"
"GO:0150033"	NA	"2.587"
"GO:1902993"	"positive regulation of amyloid precursor protein catabolic process"	"2.587"
"GO:0060412"	"ventricular septum morphogenesis"	"2.586"
"GO:0002437"	"inflammatory response to antigenic stimulus"	"2.585"
"GO:0002715"	"regulation of natural killer cell mediated immunity"	"2.584"
"GO:0003214"	"cardiac left ventricle morphogenesis"	"2.584"
"GO:0032759"	"positive regulation of TRAIL production"	"2.584"
"GO:0036037"	"CD8-positive, alpha-beta T cell activation"	"2.584"
"GO:0071902"	"positive regulation of protein serine/threonine kinase activity"	"2.583"
"GO:1904219"	"positive regulation of CDP-diacylglycerol-serine O-phosphatidyltransferase activity"	"2.582"
"GO:1904222"	"positive regulation of serine C-palmitoyltransferase activity"	"2.582"
"GO:0018916"	"nitrobenzene metabolic process"	"2.579"
"GO:0031069"	"hair follicle morphogenesis"	"2.579"
"GO:0045740"	"positive regulation of DNA replication"	"2.577"
"GO:0033540"	"fatty acid beta-oxidation using acyl-CoA oxidase"	"2.576"
"GO:0060916"	"mesenchymal cell proliferation involved in lung development"	"2.576"
"GO:0030329"	"prenylcysteine metabolic process"	"2.575"
"GO:0031018"	"endocrine pancreas development"	"2.575"
"GO:0033864"	"positive regulation of NAD(P)H oxidase activity"	"2.573"
"GO:0048545"	"response to steroid hormone"	"2.573"
"GO:0060715"	"syncytiotrophoblast cell differentiation involved in labyrinthine layer development"	"2.573"
"GO:0061833"	NA	"2.572"
"GO:1900028"	"negative regulation of ruffle assembly"	"2.571"
"GO:0033632"	"regulation of cell-cell adhesion mediated by integrin"	"2.57"
"GO:0070423"	"nucleotide-binding oligomerization domain containing signaling pathway"	"2.569"
"GO:0060411"	"cardiac septum morphogenesis"	"2.568"
"GO:0007623"	"circadian rhythm"	"2.567"
"GO:0032570"	"response to progesterone"	"2.567"
"GO:0060842"	"arterial endothelial cell differentiation"	"2.564"
"GO:0070831"	"basement membrane assembly"	"2.563"
"GO:0070164"	"negative regulation of adiponectin secretion"	"2.562"
"GO:0072012"	"glomerulus vasculature development"	"2.562"
"GO:0019732"	"antifungal humoral response"	"2.561"
"GO:0006801"	"superoxide metabolic process"	"2.56"
"GO:1904706"	"negative regulation of vascular smooth muscle cell proliferation"	"2.559"
"GO:0045071"	"negative regulation of viral genome replication"	"2.557"
"GO:0097484"	"dendrite extension"	"2.557"
"GO:0060244"	"negative regulation of cell proliferation involved in contact inhibition"	"2.556"
"GO:0070235"	"regulation of activation-induced cell death of T cells"	"2.556"
"GO:2000452"	"regulation of CD8-positive, alpha-beta cytotoxic T cell extravasation"	"2.556"
"GO:0001944"	"vasculature development"	"2.555"
"GO:0010649"	"regulation of cell communication by electrical coupling"	"2.554"
"GO:0032815"	"negative regulation of natural killer cell activation"	"2.554"
"GO:0001765"	"membrane raft assembly"	"2.553"
"GO:0010574"	"regulation of vascular endothelial growth factor production"	"2.552"
"GO:0071245"	"cellular response to carbon monoxide"	"2.552"
"GO:0098942"	"retrograde trans-synaptic signaling by trans-synaptic protein complex"	"2.552"
"GO:1903408"	"positive regulation of sodium:potassium-exchanging ATPase activity"	"2.552"
"GO:0046331"	"lateral inhibition"	"2.551"
"GO:0052405"	"negative regulation by host of symbiont molecular function"	"2.551"
"GO:0061298"	"retina vasculature development in camera-type eye"	"2.551"
"GO:0031641"	"regulation of myelination"	"2.549"
"GO:0071385"	"cellular response to glucocorticoid stimulus"	"2.549"
"GO:0007176"	"regulation of epidermal growth factor-activated receptor activity"	"2.548"
"GO:1903169"	"regulation of calcium ion transmembrane transport"	"2.548"
"GO:0018205"	"peptidyl-lysine modification"	"2.547"
"GO:0010710"	"regulation of collagen catabolic process"	"2.546"
"GO:0032288"	"myelin assembly"	"2.546"
"GO:0003294"	"atrial ventricular junction remodeling"	"2.545"
"GO:0010652"	"positive regulation of cell communication by chemical coupling"	"2.545"
"GO:2000642"	"negative regulation of early endosome to late endosome transport"	"2.545"
"GO:0042413"	"carnitine catabolic process"	"2.544"
"GO:0060750"	"epithelial cell proliferation involved in mammary gland duct elongation"	"2.544"
"GO:0043116"	"negative regulation of vascular permeability"	"2.543"
"GO:0046475"	"glycerophospholipid catabolic process"	"2.543"
"GO:1900025"	"negative regulation of substrate adhesion-dependent cell spreading"	"2.543"
"GO:0007635"	"chemosensory behavior"	"2.54"
"GO:0010255"	"glucose mediated signaling pathway"	"2.54"
"GO:0002519"	"natural killer cell tolerance induction"	"2.536"
"GO:0035624"	"receptor transactivation"	"2.536"
"GO:0097756"	NA	"2.534"
"GO:0098664"	NA	"2.534"
"GO:2000484"	"positive regulation of interleukin-8 secretion"	"2.534"
"GO:0010827"	"regulation of glucose transport"	"2.533"
"GO:0021688"	"cerebellar molecular layer formation"	"2.533"
"GO:0048631"	"regulation of skeletal muscle tissue growth"	"2.533"
"GO:0060853"	"Notch signaling pathway involved in arterial endothelial cell fate commitment"	"2.533"
"GO:0098773"	"skin epidermis development"	"2.533"
"GO:0003093"	"regulation of glomerular filtration"	"2.531"
"GO:0060017"	"parathyroid gland development"	"2.531"
"GO:2001303"	"lipoxin A4 biosynthetic process"	"2.531"
"GO:0048853"	"forebrain morphogenesis"	"2.528"
"GO:1901687"	"glutathione derivative biosynthetic process"	"2.527"
"GO:0070977"	"bone maturation"	"2.525"
"GO:0010819"	"regulation of T cell chemotaxis"	"2.521"
"GO:1904588"	"cellular response to glycoprotein"	"2.52"
"GO:1905229"	"cellular response to thyrotropin-releasing hormone"	"2.52"
"GO:0048340"	"paraxial mesoderm morphogenesis"	"2.517"
"GO:0007589"	"body fluid secretion"	"2.516"
"GO:0032401"	"establishment of melanosome localization"	"2.516"
"GO:0060948"	"cardiac vascular smooth muscle cell development"	"2.515"
"GO:0038061"	"NIK/NF-kappaB signaling"	"2.513"
"GO:0055118"	"negative regulation of cardiac muscle contraction"	"2.511"
"GO:1903232"	"melanosome assembly"	"2.51"
"GO:0038033"	"positive regulation of endothelial cell chemotaxis by VEGF-activated vascular endothelial growth factor receptor signaling pathway"	"2.509"
"GO:0001764"	"neuron migration"	"2.507"
"GO:0003281"	"ventricular septum development"	"2.507"
"GO:0051446"	"positive regulation of meiotic cell cycle"	"2.507"
"GO:1901529"	"positive regulation of anion channel activity"	"2.507"
"GO:0010718"	"positive regulation of epithelial to mesenchymal transition"	"2.506"
"GO:0036302"	"atrioventricular canal development"	"2.505"
"GO:0042323"	"negative regulation of circadian sleep/wake cycle, non-REM sleep"	"2.505"
"GO:0060668"	"regulation of branching involved in salivary gland morphogenesis by extracellular matrix-epithelial cell signaling"	"2.505"
"GO:0070256"	"negative regulation of mucus secretion"	"2.505"
"GO:0008344"	"adult locomotory behavior"	"2.504"
"GO:0019218"	"regulation of steroid metabolic process"	"2.504"
"GO:1903575"	"cornified envelope assembly"	"2.504"
"GO:0035425"	"autocrine signaling"	"2.5"
"GO:1902003"	"regulation of beta-amyloid formation"	"2.5"
"GO:0038189"	"neuropilin signaling pathway"	"2.499"
"GO:0048701"	"embryonic cranial skeleton morphogenesis"	"2.499"
"GO:0043124"	"negative regulation of I-kappaB kinase/NF-kappaB signaling"	"2.497"
"GO:0060529"	"squamous basal epithelial stem cell differentiation involved in prostate gland acinus development"	"2.496"
"GO:0099612"	"protein localization to axon"	"2.496"
"GO:0070681"	"glutaminyl-tRNAGln biosynthesis via transamidation"	"2.495"
"GO:0021675"	"nerve development"	"2.494"
"GO:0090166"	"Golgi disassembly"	"2.491"
"GO:0098869"	"cellular oxidant detoxification"	"2.491"
"GO:0001080"	"nitrogen catabolite activation of transcription from RNA polymerase II promoter"	"2.487"
"GO:0007566"	"embryo implantation"	"2.487"
"GO:0034255"	"regulation of urea metabolic process"	"2.487"
"GO:0038185"	"intracellular bile acid receptor signaling pathway"	"2.487"
"GO:1905695"	NA	"2.487"
"GO:2000213"	"positive regulation of glutamate metabolic process"	"2.487"
"GO:2001250"	"positive regulation of ammonia assimilation cycle"	"2.487"
"GO:2000301"	"negative regulation of synaptic vesicle exocytosis"	"2.485"
"GO:0032414"	"positive regulation of ion transmembrane transporter activity"	"2.483"
"GO:2000273"	"positive regulation of receptor activity"	"2.48"
"GO:0097102"	"endothelial tip cell fate specification"	"2.478"
"GO:0022400"	"regulation of rhodopsin mediated signaling pathway"	"2.477"
"GO:2001280"	"positive regulation of unsaturated fatty acid biosynthetic process"	"2.477"
"GO:0003197"	"endocardial cushion development"	"2.475"
"GO:0007274"	"neuromuscular synaptic transmission"	"2.475"
"GO:0042723"	"thiamine-containing compound metabolic process"	"2.475"
"GO:0048872"	"homeostasis of number of cells"	"2.474"
"GO:0031223"	"auditory behavior"	"2.473"
"GO:0015911"	"plasma membrane long-chain fatty acid transport"	"2.472"
"GO:2000146"	"negative regulation of cell motility"	"2.47"
"GO:0015813"	"L-glutamate transport"	"2.469"
"GO:0006481"	"C-terminal protein methylation"	"2.466"
"GO:0035408"	"histone H3-T6 phosphorylation"	"2.466"
"GO:0043276"	"anoikis"	"2.463"
"GO:0014047"	"glutamate secretion"	"2.461"
"GO:0034695"	"response to prostaglandin E"	"2.461"
"GO:0050869"	"negative regulation of B cell activation"	"2.461"
"GO:0071712"	"ER-associated misfolded protein catabolic process"	"2.461"
"GO:0042590"	"antigen processing and presentation of exogenous peptide antigen via MHC class I"	"2.46"
"GO:0051725"	"protein de-ADP-ribosylation"	"2.459"
"GO:0090045"	"positive regulation of deacetylase activity"	"2.459"
"GO:0009159"	"deoxyribonucleoside monophosphate catabolic process"	"2.458"
"GO:0019323"	"pentose catabolic process"	"2.458"
"GO:0000038"	"very long-chain fatty acid metabolic process"	"2.457"
"GO:0044242"	"cellular lipid catabolic process"	"2.457"
"GO:0048251"	"elastic fiber assembly"	"2.457"
"GO:0060745"	"mammary gland branching involved in pregnancy"	"2.455"
"GO:1901509"	"regulation of endothelial tube morphogenesis"	"2.455"
"GO:0055075"	"potassium ion homeostasis"	"2.454"
"GO:0099133"	NA	"2.454"
"GO:0002328"	"pro-B cell differentiation"	"2.453"
"GO:0072718"	"response to cisplatin"	"2.452"
"GO:0060739"	"mesenchymal-epithelial cell signaling involved in prostate gland development"	"2.45"
"GO:0042747"	"circadian sleep/wake cycle, REM sleep"	"2.449"
"GO:0008064"	"regulation of actin polymerization or depolymerization"	"2.448"
"GO:0010952"	"positive regulation of peptidase activity"	"2.448"
"GO:0010524"	"positive regulation of calcium ion transport into cytosol"	"2.444"
"GO:0032417"	"positive regulation of sodium:proton antiporter activity"	"2.443"
"GO:1900122"	"positive regulation of receptor binding"	"2.442"
"GO:0030260"	"entry into host cell"	"2.441"
"GO:0032720"	"negative regulation of tumor necrosis factor production"	"2.44"
"GO:0090044"	"positive regulation of tubulin deacetylation"	"2.44"
"GO:1903307"	"positive regulation of regulated secretory pathway"	"2.439"
"GO:2001213"	"negative regulation of vasculogenesis"	"2.439"
"GO:0060599"	"lateral sprouting involved in mammary gland duct morphogenesis"	"2.438"
"GO:0006809"	"nitric oxide biosynthetic process"	"2.437"
"GO:0016339"	"calcium-dependent cell-cell adhesion via plasma membrane cell adhesion molecules"	"2.437"
"GO:0051545"	"negative regulation of elastin biosynthetic process"	"2.437"
"GO:0032723"	"positive regulation of connective tissue growth factor production"	"2.436"
"GO:0060502"	"epithelial cell proliferation involved in lung morphogenesis"	"2.436"
"GO:0014031"	"mesenchymal cell development"	"2.435"
"GO:0016579"	"protein deubiquitination"	"2.435"
"GO:0031116"	"positive regulation of microtubule polymerization"	"2.435"
"GO:0060177"	"regulation of angiotensin metabolic process"	"2.434"
"GO:0050821"	"protein stabilization"	"2.433"
"GO:0060443"	"mammary gland morphogenesis"	"2.433"
"GO:0009225"	"nucleotide-sugar metabolic process"	"2.432"
"GO:0043242"	"negative regulation of protein complex disassembly"	"2.432"
"GO:0051882"	"mitochondrial depolarization"	"2.432"
"GO:0070309"	"lens fiber cell morphogenesis"	"2.431"
"GO:0003335"	"corneocyte development"	"2.43"
"GO:0050808"	"synapse organization"	"2.43"
"GO:0015951"	"purine ribonucleotide interconversion"	"2.429"
"GO:0045792"	"negative regulation of cell size"	"2.426"
"GO:0060292"	"long term synaptic depression"	"2.426"
"GO:0045659"	"negative regulation of neutrophil differentiation"	"2.425"
"GO:0007029"	"endoplasmic reticulum organization"	"2.424"
"GO:0044351"	"macropinocytosis"	"2.424"
"GO:0032836"	"glomerular basement membrane development"	"2.423"
"GO:1990314"	"cellular response to insulin-like growth factor stimulus"	"2.423"
"GO:0038026"	"reelin-mediated signaling pathway"	"2.422"
"GO:1903598"	"positive regulation of gap junction assembly"	"2.422"
"GO:1990266"	"neutrophil migration"	"2.421"
"GO:1905322"	"positive regulation of mesenchymal stem cell migration"	"2.419"
"GO:0019303"	"D-ribose catabolic process"	"2.418"
"GO:0071816"	"tail-anchored membrane protein insertion into ER membrane"	"2.418"
"GO:0097300"	"programmed necrotic cell death"	"2.417"
"GO:0099050"	"vesicle scission"	"2.417"
"GO:0001561"	"fatty acid alpha-oxidation"	"2.416"
"GO:2000473"	"positive regulation of hematopoietic stem cell migration"	"2.416"
"GO:0002230"	"positive regulation of defense response to virus by host"	"2.414"
"GO:1904030"	"negative regulation of cyclin-dependent protein kinase activity"	"2.413"
"GO:0048664"	"neuron fate determination"	"2.412"
"GO:0019087"	"transformation of host cell by virus"	"2.411"
"GO:0098883"	"synapse disassembly"	"2.41"
"GO:0099588"	"positive regulation of postsynaptic cytosolic calcium concentration"	"2.41"
"GO:1905355"	"spine apparatus assembly"	"2.41"
"GO:0060695"	"negative regulation of cholesterol transporter activity"	"2.409"
"GO:0060454"	"positive regulation of gastric acid secretion"	"2.407"
"GO:0045844"	"positive regulation of striated muscle tissue development"	"2.406"
"GO:0038183"	"bile acid signaling pathway"	"2.405"
"GO:0090306"	"spindle assembly involved in meiosis"	"2.405"
"GO:0046339"	"diacylglycerol metabolic process"	"2.403"
"GO:1903762"	"positive regulation of voltage-gated potassium channel activity involved in ventricular cardiac muscle cell action potential repolarization"	"2.403"
"GO:0048304"	"positive regulation of isotype switching to IgG isotypes"	"2.402"
"GO:0060414"	"aorta smooth muscle tissue morphogenesis"	"2.402"
"GO:0015884"	"folic acid transport"	"2.399"
"GO:0072164"	"mesonephric tubule development"	"2.399"
"GO:0032814"	"regulation of natural killer cell activation"	"2.398"
"GO:0036336"	"dendritic cell migration"	"2.398"
"GO:0060587"	"regulation of lipoprotein lipid oxidation"	"2.398"
"GO:0071298"	"cellular response to L-ascorbic acid"	"2.398"
"GO:1904651"	"positive regulation of fat cell apoptotic process"	"2.398"
"GO:2000486"	"negative regulation of glutamine transport"	"2.398"
"GO:0032687"	"negative regulation of interferon-alpha production"	"2.397"
"GO:1902358"	"sulfate transmembrane transport"	"2.396"
"GO:0044794"	"positive regulation by host of viral process"	"2.394"
"GO:0016486"	"peptide hormone processing"	"2.393"
"GO:0046580"	"negative regulation of Ras protein signal transduction"	"2.393"
"GO:1903488"	"negative regulation of lactation"	"2.393"
"GO:0035773"	"insulin secretion involved in cellular response to glucose stimulus"	"2.391"
"GO:0071569"	"protein ufmylation"	"2.391"
"GO:1901898"	"negative regulation of relaxation of cardiac muscle"	"2.391"
"GO:0006490"	"oligosaccharide-lipid intermediate biosynthetic process"	"2.39"
"GO:0010988"	"regulation of low-density lipoprotein particle clearance"	"2.387"
"GO:0051788"	"response to misfolded protein"	"2.387"
"GO:0031914"	"negative regulation of synaptic plasticity"	"2.385"
"GO:0001913"	"T cell mediated cytotoxicity"	"2.382"
"GO:0035666"	"TRIF-dependent toll-like receptor signaling pathway"	"2.382"
"GO:0046579"	"positive regulation of Ras protein signal transduction"	"2.382"
"GO:1990791"	"dorsal root ganglion development"	"2.382"
"GO:0046359"	"butyrate catabolic process"	"2.381"
"GO:0021892"	"cerebral cortex GABAergic interneuron differentiation"	"2.38"
"GO:0003014"	"renal system process"	"2.379"
"GO:0061771"	"response to caloric restriction"	"2.377"
"GO:0086050"	"membrane repolarization during bundle of His cell action potential"	"2.377"
"GO:0086052"	"membrane repolarization during SA node cell action potential"	"2.377"
"GO:1903551"	"regulation of extracellular exosome assembly"	"2.377"
"GO:0045580"	"regulation of T cell differentiation"	"2.376"
"GO:0045744"	"negative regulation of G-protein coupled receptor protein signaling pathway"	"2.376"
"GO:0002028"	"regulation of sodium ion transport"	"2.375"
"GO:0003051"	"angiotensin-mediated drinking behavior"	"2.375"
"GO:0002024"	"diet induced thermogenesis"	"2.374"
"GO:0035633"	"maintenance of blood-brain barrier"	"2.373"
"GO:0071506"	"cellular response to mycophenolic acid"	"2.371"
"GO:0039529"	"RIG-I signaling pathway"	"2.369"
"GO:0015942"	"formate metabolic process"	"2.367"
"GO:0060355"	"positive regulation of cell adhesion molecule production"	"2.367"
"GO:0048549"	"positive regulation of pinocytosis"	"2.363"
"GO:2001214"	"positive regulation of vasculogenesis"	"2.363"
"GO:0010820"	"positive regulation of T cell chemotaxis"	"2.361"
"GO:0071391"	"cellular response to estrogen stimulus"	"2.358"
"GO:0061847"	NA	"2.354"
"GO:0071538"	"SH2 domain-mediated complex assembly"	"2.354"
"GO:1990859"	"cellular response to endothelin"	"2.354"
"GO:0060335"	"positive regulation of interferon-gamma-mediated signaling pathway"	"2.353"
"GO:0032480"	"negative regulation of type I interferon production"	"2.352"
"GO:0033343"	"positive regulation of collagen binding"	"2.349"
"GO:0035308"	"negative regulation of protein dephosphorylation"	"2.349"
"GO:0045607"	"regulation of auditory receptor cell differentiation"	"2.347"
"GO:0099553"	"trans-synaptic signaling by endocannabinoid, modulating synaptic transmission"	"2.347"
"GO:0035963"	"cellular response to interleukin-13"	"2.344"
"GO:0001947"	"heart looping"	"2.343"
"GO:0052548"	"regulation of endopeptidase activity"	"2.343"
"GO:0072369"	"regulation of lipid transport by positive regulation of transcription from RNA polymerase II promoter"	"2.342"
"GO:0060290"	"transdifferentiation"	"2.341"
"GO:0015825"	"L-serine transport"	"2.34"
"GO:0050702"	"interleukin-1 beta secretion"	"2.338"
"GO:0070741"	"response to interleukin-6"	"2.338"
"GO:0006568"	"tryptophan metabolic process"	"2.337"
"GO:1905590"	NA	"2.336"
"GO:0046619"	"optic placode formation involved in camera-type eye formation"	"2.334"
"GO:0006940"	"regulation of smooth muscle contraction"	"2.333"
"GO:0051142"	"positive regulation of NK T cell proliferation"	"2.333"
"GO:0033030"	"negative regulation of neutrophil apoptotic process"	"2.331"
"GO:0099509"	"regulation of presynaptic cytosolic calcium ion concentration"	"2.331"
"GO:0006658"	"phosphatidylserine metabolic process"	"2.329"
"GO:0048320"	"axial mesoderm formation"	"2.329"
"GO:0060035"	"notochord cell development"	"2.329"
"GO:1904238"	"pericyte cell differentiation"	"2.329"
"GO:0032966"	"negative regulation of collagen biosynthetic process"	"2.328"
"GO:0021955"	"central nervous system neuron axonogenesis"	"2.327"
"GO:0042321"	"negative regulation of circadian sleep/wake cycle, sleep"	"2.326"
"GO:0070091"	"glucagon secretion"	"2.326"
"GO:1901725"	"regulation of histone deacetylase activity"	"2.325"
"GO:0032754"	"positive regulation of interleukin-5 production"	"2.324"
"GO:0050790"	"regulation of catalytic activity"	"2.322"
"GO:0071461"	"cellular response to redox state"	"2.322"
"GO:0010711"	"negative regulation of collagen catabolic process"	"2.321"
"GO:0043067"	"regulation of programmed cell death"	"2.321"
"GO:0044062"	"regulation of excretion"	"2.321"
"GO:0060311"	"negative regulation of elastin catabolic process"	"2.321"
"GO:0045600"	"positive regulation of fat cell differentiation"	"2.32"
"GO:0045646"	"regulation of erythrocyte differentiation"	"2.32"
"GO:1902443"	"negative regulation of ripoptosome assembly involved in necroptotic process"	"2.32"
"GO:0043372"	"positive regulation of CD4-positive, alpha-beta T cell differentiation"	"2.318"
"GO:0048278"	"vesicle docking"	"2.318"
"GO:0007258"	"JUN phosphorylation"	"2.317"
"GO:0008045"	"motor neuron axon guidance"	"2.317"
"GO:0006821"	"chloride transport"	"2.316"
"GO:0045599"	"negative regulation of fat cell differentiation"	"2.315"
"GO:1903428"	"positive regulation of reactive oxygen species biosynthetic process"	"2.315"
"GO:2000612"	"regulation of thyroid-stimulating hormone secretion"	"2.314"
"GO:0044565"	"dendritic cell proliferation"	"2.312"
"GO:0031664"	"regulation of lipopolysaccharide-mediated signaling pathway"	"2.311"
"GO:1901797"	"negative regulation of signal transduction by p53 class mediator"	"2.308"
"GO:0031999"	"negative regulation of fatty acid beta-oxidation"	"2.306"
"GO:0015701"	"bicarbonate transport"	"2.304"
"GO:0048685"	"negative regulation of collateral sprouting of intact axon in response to injury"	"2.304"
"GO:0032674"	"regulation of interleukin-5 production"	"2.303"
"GO:0001508"	"action potential"	"2.302"
"GO:0015798"	"myo-inositol transport"	"2.301"
"GO:0007043"	"cell-cell junction assembly"	"2.3"
"GO:0002643"	"regulation of tolerance induction"	"2.299"
"GO:1903202"	"negative regulation of oxidative stress-induced cell death"	"2.296"
"GO:0001570"	"vasculogenesis"	"2.295"
"GO:0006720"	"isoprenoid metabolic process"	"2.292"
"GO:0033173"	"calcineurin-NFAT signaling cascade"	"2.292"
"GO:2001020"	"regulation of response to DNA damage stimulus"	"2.289"
"GO:0014734"	"skeletal muscle hypertrophy"	"2.288"
"GO:0035295"	"tube development"	"2.288"
"GO:0038133"	"ERBB2-ERBB3 signaling pathway"	"2.288"
"GO:0009749"	"response to glucose"	"2.286"
"GO:0070571"	"negative regulation of neuron projection regeneration"	"2.286"
"GO:0097749"	NA	"2.285"
"GO:1900168"	"positive regulation of glial cell-derived neurotrophic factor secretion"	"2.285"
"GO:0003148"	"outflow tract septum morphogenesis"	"2.284"
"GO:0032212"	"positive regulation of telomere maintenance via telomerase"	"2.281"
"GO:0032079"	"positive regulation of endodeoxyribonuclease activity"	"2.277"
"GO:0043583"	"ear development"	"2.277"
"GO:0070572"	"positive regulation of neuron projection regeneration"	"2.277"
"GO:1902947"	"regulation of tau-protein kinase activity"	"2.277"
"GO:0033077"	"T cell differentiation in thymus"	"2.276"
"GO:0016032"	"viral process"	"2.275"
"GO:0038123"	"toll-like receptor TLR1:TLR2 signaling pathway"	"2.275"
"GO:0071727"	"cellular response to triacyl bacterial lipopeptide"	"2.275"
"GO:0055002"	"striated muscle cell development"	"2.273"
"GO:2000504"	"positive regulation of blood vessel remodeling"	"2.273"
"GO:0006972"	"hyperosmotic response"	"2.272"
"GO:0048144"	"fibroblast proliferation"	"2.272"
"GO:0032467"	"positive regulation of cytokinesis"	"2.271"
"GO:0042994"	"cytoplasmic sequestering of transcription factor"	"2.27"
"GO:0034633"	"retinol transport"	"2.269"
"GO:0050672"	"negative regulation of lymphocyte proliferation"	"2.268"
"GO:0042100"	"B cell proliferation"	"2.267"
"GO:0003279"	"cardiac septum development"	"2.266"
"GO:0030262"	"apoptotic nuclear changes"	"2.265"
"GO:0010955"	"negative regulation of protein processing"	"2.264"
"GO:0046676"	"negative regulation of insulin secretion"	"2.264"
"GO:0060706"	"cell differentiation involved in embryonic placenta development"	"2.263"
"GO:1902202"	"regulation of hepatocyte growth factor receptor signaling pathway"	"2.263"
"GO:0035621"	"ER to Golgi ceramide transport"	"2.262"
"GO:0035910"	"ascending aorta morphogenesis"	"2.262"
"GO:0003283"	"atrial septum development"	"2.261"
"GO:0007530"	"sex determination"	"2.261"
"GO:0038163"	"thrombopoietin-mediated signaling pathway"	"2.261"
"GO:0045062"	"extrathymic T cell selection"	"2.26"
"GO:0071476"	"cellular hypotonic response"	"2.259"
"GO:0071673"	"positive regulation of smooth muscle cell chemotaxis"	"2.259"
"GO:0045668"	"negative regulation of osteoblast differentiation"	"2.258"
"GO:0071672"	"negative regulation of smooth muscle cell chemotaxis"	"2.258"
"GO:0045663"	"positive regulation of myoblast differentiation"	"2.257"
"GO:0001922"	"B-1 B cell homeostasis"	"2.255"
"GO:0060907"	"positive regulation of macrophage cytokine production"	"2.255"
"GO:0045723"	"positive regulation of fatty acid biosynthetic process"	"2.254"
"GO:0046390"	"ribose phosphate biosynthetic process"	"2.254"
"GO:0050917"	"sensory perception of umami taste"	"2.253"
"GO:0061052"	"negative regulation of cell growth involved in cardiac muscle cell development"	"2.253"
"GO:0010727"	"negative regulation of hydrogen peroxide metabolic process"	"2.252"
"GO:0002674"	"negative regulation of acute inflammatory response"	"2.25"
"GO:0031943"	"regulation of glucocorticoid metabolic process"	"2.25"
"GO:0033081"	"regulation of T cell differentiation in thymus"	"2.25"
"GO:2000810"	"regulation of bicellular tight junction assembly"	"2.247"
"GO:0009414"	"response to water deprivation"	"2.245"
"GO:0039020"	"pronephric nephron tubule development"	"2.245"
"GO:0060677"	"ureteric bud elongation"	"2.245"
"GO:0061296"	"negative regulation of mesenchymal cell apoptotic process involved in mesonephric nephron morphogenesis"	"2.245"
"GO:0031642"	"negative regulation of myelination"	"2.244"
"GO:0042552"	"myelination"	"2.244"
"GO:0002458"	"peripheral T cell tolerance induction"	"2.242"
"GO:0002509"	"central tolerance induction to self antigen"	"2.242"
"GO:0045176"	"apical protein localization"	"2.242"
"GO:1904530"	"negative regulation of actin filament binding"	"2.242"
"GO:2000410"	"regulation of thymocyte migration"	"2.242"
"GO:0030913"	"paranodal junction assembly"	"2.241"
