"GO.ID"	"GO.Term"	"zscore"
"GO:0007620"	"copulation"	"1.012"
"GO:0030238"	"male sex determination"	"1.012"
"GO:0046958"	"nonassociative learning"	"1.012"
"GO:0014843"	"growth factor dependent regulation of skeletal muscle satellite cell proliferation"	"1.011"
"GO:0042660"	"positive regulation of cell fate specification"	"1.011"
"GO:0043697"	"cell dedifferentiation"	"1.01"
"GO:0051102"	"DNA ligation involved in DNA recombination"	"1.01"
"GO:0051932"	"synaptic transmission, GABAergic"	"1.01"
"GO:1900138"	"negative regulation of phospholipase A2 activity"	"1.01"
"GO:0001923"	"B-1 B cell differentiation"	"1.009"
"GO:0002070"	"epithelial cell maturation"	"1.009"
"GO:0002730"	"regulation of dendritic cell cytokine production"	"1.009"
"GO:0034346"	"positive regulation of type III interferon production"	"1.009"
"GO:0035066"	"positive regulation of histone acetylation"	"1.009"
"GO:0042182"	"ketone catabolic process"	"1.009"
"GO:0044375"	"regulation of peroxisome size"	"1.009"
"GO:0046950"	"cellular ketone body metabolic process"	"1.009"
"GO:0070278"	"extracellular matrix constituent secretion"	"1.009"
"GO:2001252"	"positive regulation of chromosome organization"	"1.009"
"GO:0001763"	"morphogenesis of a branching structure"	"1.007"
"GO:0033153"	"T cell receptor V(D)J recombination"	"1.007"
"GO:1900006"	"positive regulation of dendrite development"	"1.007"
"GO:0051204"	"protein insertion into mitochondrial membrane"	"1.006"
"GO:1900235"	"negative regulation of Kit signaling pathway"	"1.006"
"GO:0022405"	"hair cycle process"	"1.005"
"GO:0046479"	"glycosphingolipid catabolic process"	"1.004"
"GO:0061445"	"endocardial cushion cell fate commitment"	"1.004"
"GO:0072697"	"protein localization to cell cortex"	"1.004"
"GO:2000017"	"positive regulation of determination of dorsal identity"	"1.004"
"GO:0033032"	"regulation of myeloid cell apoptotic process"	"1.003"
"GO:0033059"	"cellular pigmentation"	"1.003"
"GO:0048172"	"regulation of short-term neuronal synaptic plasticity"	"1.003"
"GO:0006783"	"heme biosynthetic process"	"1.002"
"GO:0048048"	"embryonic eye morphogenesis"	"1.002"
"GO:0050810"	"regulation of steroid biosynthetic process"	"1.002"
"GO:0071947"	"protein deubiquitination involved in ubiquitin-dependent protein catabolic process"	"1.002"
"GO:1902603"	"carnitine transmembrane transport"	"1.002"
"GO:0007021"	"tubulin complex assembly"	"1.001"
"GO:0001980"	"regulation of systemic arterial blood pressure by ischemic conditions"	"0.999"
"GO:0006788"	"heme oxidation"	"0.999"
"GO:0031550"	"positive regulation of brain-derived neurotrophic factor receptor signaling pathway"	"0.999"
"GO:0048732"	"gland development"	"0.998"
"GO:0051612"	"negative regulation of serotonin uptake"	"0.998"
"GO:0022007"	"convergent extension involved in neural plate elongation"	"0.996"
"GO:0051865"	"protein autoubiquitination"	"0.996"
"GO:1990641"	"response to iron ion starvation"	"0.996"
"GO:1990786"	"cellular response to dsDNA"	"0.996"
"GO:0002532"	"production of molecular mediator involved in inflammatory response"	"0.995"
"GO:0086092"	"regulation of the force of heart contraction by cardiac conduction"	"0.995"
"GO:2000637"	"positive regulation of gene silencing by miRNA"	"0.995"
"GO:0006891"	"intra-Golgi vesicle-mediated transport"	"0.994"
"GO:0045105"	"intermediate filament polymerization or depolymerization"	"0.993"
"GO:1903935"	"response to sodium arsenite"	"0.993"
"GO:0086045"	"membrane depolarization during AV node cell action potential"	"0.992"
"GO:0048298"	"positive regulation of isotype switching to IgA isotypes"	"0.99"
"GO:1902513"	"regulation of organelle transport along microtubule"	"0.989"
"GO:0008209"	"androgen metabolic process"	"0.988"
"GO:2000852"	"regulation of corticosterone secretion"	"0.988"
"GO:0021772"	"olfactory bulb development"	"0.987"
"GO:0005979"	"regulation of glycogen biosynthetic process"	"0.986"
"GO:0045597"	"positive regulation of cell differentiation"	"0.986"
"GO:0060384"	"innervation"	"0.986"
"GO:0071657"	"positive regulation of granulocyte colony-stimulating factor production"	"0.985"
"GO:0051248"	"negative regulation of protein metabolic process"	"0.984"
"GO:0061551"	"trigeminal ganglion development"	"0.984"
"GO:0035609"	"C-terminal protein deglutamylation"	"0.983"
"GO:0048858"	"cell projection morphogenesis"	"0.982"
"GO:1904425"	"negative regulation of GTP binding"	"0.981"
"GO:0033132"	"negative regulation of glucokinase activity"	"0.98"
"GO:0045761"	"regulation of adenylate cyclase activity"	"0.98"
"GO:0070352"	"positive regulation of white fat cell proliferation"	"0.98"
"GO:0043171"	"peptide catabolic process"	"0.979"
"GO:0048378"	"regulation of lateral mesodermal cell fate specification"	"0.979"
"GO:0003165"	"Purkinje myocyte development"	"0.978"
"GO:0021707"	"cerebellar granule cell differentiation"	"0.978"
"GO:0045040"	"protein import into mitochondrial outer membrane"	"0.978"
"GO:0001702"	"gastrulation with mouth forming second"	"0.977"
"GO:0032870"	"cellular response to hormone stimulus"	"0.977"
"GO:1900169"	"regulation of glucocorticoid mediated signaling pathway"	"0.977"
"GO:0050896"	"response to stimulus"	"0.976"
"GO:0001808"	"negative regulation of type IV hypersensitivity"	"0.975"
"GO:0002765"	"immune response-inhibiting signal transduction"	"0.975"
"GO:0051653"	"spindle localization"	"0.975"
"GO:0034214"	"protein hexamerization"	"0.974"
"GO:0061485"	"memory T cell proliferation"	"0.974"
"GO:0038129"	"ERBB3 signaling pathway"	"0.973"
"GO:1901385"	"regulation of voltage-gated calcium channel activity"	"0.971"
"GO:2000271"	"positive regulation of fibroblast apoptotic process"	"0.971"
"GO:0035458"	"cellular response to interferon-beta"	"0.97"
"GO:0021702"	"cerebellar Purkinje cell differentiation"	"0.968"
"GO:0006515"	"misfolded or incompletely synthesized protein catabolic process"	"0.967"
"GO:0009056"	"catabolic process"	"0.967"
"GO:0032515"	"negative regulation of phosphoprotein phosphatase activity"	"0.967"
"GO:0002038"	"positive regulation of L-glutamate transport"	"0.965"
"GO:0044818"	"mitotic G2/M transition checkpoint"	"0.964"
"GO:2000466"	"negative regulation of glycogen (starch) synthase activity"	"0.964"
"GO:0007031"	"peroxisome organization"	"0.963"
"GO:2000368"	"positive regulation of acrosomal vesicle exocytosis"	"0.963"
"GO:0032805"	"positive regulation of low-density lipoprotein particle receptor catabolic process"	"0.962"
"GO:0061549"	"sympathetic ganglion development"	"0.962"
"GO:0031998"	"regulation of fatty acid beta-oxidation"	"0.961"
"GO:0080111"	"DNA demethylation"	"0.961"
"GO:1903565"	"negative regulation of protein localization to cilium"	"0.961"
"GO:1903568"	"negative regulation of protein localization to ciliary membrane"	"0.961"
"GO:2001204"	"regulation of osteoclast development"	"0.959"
"GO:0001960"	"negative regulation of cytokine-mediated signaling pathway"	"0.958"
"GO:0003300"	"cardiac muscle hypertrophy"	"0.958"
"GO:0060702"	"negative regulation of endoribonuclease activity"	"0.957"
"GO:0022614"	"membrane to membrane docking"	"0.956"
"GO:0033539"	"fatty acid beta-oxidation using acyl-CoA dehydrogenase"	"0.956"
"GO:0048485"	"sympathetic nervous system development"	"0.956"
"GO:0050905"	"neuromuscular process"	"0.956"
"GO:2000667"	"positive regulation of interleukin-13 secretion"	"0.956"
"GO:0042335"	"cuticle development"	"0.955"
"GO:0060391"	"positive regulation of SMAD protein import into nucleus"	"0.955"
"GO:0002875"	"negative regulation of chronic inflammatory response to antigenic stimulus"	"0.952"
"GO:0006083"	"acetate metabolic process"	"0.952"
"GO:0045636"	"positive regulation of melanocyte differentiation"	"0.952"
"GO:1903034"	"regulation of response to wounding"	"0.952"
"GO:0021842"	"chemorepulsion involved in interneuron migration from the subpallium to the cortex"	"0.951"
"GO:0006655"	"phosphatidylglycerol biosynthetic process"	"0.95"
"GO:0046849"	"bone remodeling"	"0.95"
"GO:0046657"	"folic acid catabolic process"	"0.949"
"GO:0090188"	"negative regulation of pancreatic juice secretion"	"0.949"
"GO:0090118"	"receptor-mediated endocytosis of low-density lipoprotein particle involved in cholesterol transport"	"0.948"
"GO:0046578"	"regulation of Ras protein signal transduction"	"0.946"
"GO:0061640"	"cytoskeleton-dependent cytokinesis"	"0.945"
"GO:0002540"	"leukotriene production involved in inflammatory response"	"0.944"
"GO:1990108"	"protein linear deubiquitination"	"0.944"
"GO:0031960"	"response to corticosteroid"	"0.942"
"GO:0032488"	"Cdc42 protein signal transduction"	"0.942"
"GO:1905097"	"regulation of guanyl-nucleotide exchange factor activity"	"0.942"
"GO:0016052"	"carbohydrate catabolic process"	"0.941"
"GO:0042491"	"auditory receptor cell differentiation"	"0.941"
"GO:0071641"	"negative regulation of macrophage inflammatory protein 1 alpha production"	"0.941"
"GO:0070228"	"regulation of lymphocyte apoptotic process"	"0.94"
"GO:0070236"	"negative regulation of activation-induced cell death of T cells"	"0.94"
"GO:0010950"	"positive regulation of endopeptidase activity"	"0.939"
"GO:0046622"	"positive regulation of organ growth"	"0.939"
"GO:2000158"	"positive regulation of ubiquitin-specific protease activity"	"0.939"
"GO:2001311"	"lysobisphosphatidic acid metabolic process"	"0.939"
"GO:1902721"	"negative regulation of prolactin secretion"	"0.938"
"GO:1902766"	"skeletal muscle satellite cell migration"	"0.938"
"GO:0090035"	"positive regulation of chaperone-mediated protein complex assembly"	"0.937"
"GO:0090263"	"positive regulation of canonical Wnt signaling pathway"	"0.937"
"GO:1903225"	"negative regulation of endodermal cell differentiation"	"0.937"
"GO:0045624"	"positive regulation of T-helper cell differentiation"	"0.936"
"GO:1904761"	"negative regulation of myofibroblast differentiation"	"0.936"
"GO:1904899"	"positive regulation of hepatic stellate cell proliferation"	"0.936"
"GO:1902905"	"positive regulation of fibril organization"	"0.934"
"GO:0006112"	"energy reserve metabolic process"	"0.932"
"GO:0006649"	"phospholipid transfer to membrane"	"0.932"
"GO:0045639"	"positive regulation of myeloid cell differentiation"	"0.931"
"GO:0097084"	"vascular smooth muscle cell development"	"0.931"
"GO:0070293"	"renal absorption"	"0.93"
"GO:0002194"	"hepatocyte cell migration"	"0.928"
"GO:0003186"	"tricuspid valve morphogenesis"	"0.928"
"GO:0042886"	"amide transport"	"0.928"
"GO:0043049"	"otic placode formation"	"0.928"
"GO:0050823"	"peptide antigen stabilization"	"0.928"
"GO:0061114"	"branching involved in pancreas morphogenesis"	"0.928"
"GO:0090425"	"acinar cell differentiation"	"0.928"
"GO:1901978"	"positive regulation of cell cycle checkpoint"	"0.928"
"GO:2000979"	"positive regulation of forebrain neuron differentiation"	"0.928"
"GO:0002460"	"adaptive immune response based on somatic recombination of immune receptors built from immunoglobulin superfamily domains"	"0.927"
"GO:0009817"	"defense response to fungus, incompatible interaction"	"0.927"
"GO:0019348"	"dolichol metabolic process"	"0.927"
"GO:0032667"	"regulation of interleukin-23 production"	"0.927"
"GO:0051795"	"positive regulation of catagen"	"0.927"
"GO:0060751"	"branch elongation involved in mammary gland duct branching"	"0.927"
"GO:1903911"	"positive regulation of receptor clustering"	"0.927"
"GO:1905313"	"transforming growth factor beta receptor signaling pathway involved in heart development"	"0.927"
"GO:1990402"	"embryonic liver development"	"0.927"
"GO:0002295"	"T-helper cell lineage commitment"	"0.926"
"GO:0006853"	"carnitine shuttle"	"0.926"
"GO:0035694"	"mitochondrial protein catabolic process"	"0.926"
"GO:0045403"	"negative regulation of interleukin-4 biosynthetic process"	"0.926"
"GO:0060377"	"negative regulation of mast cell differentiation"	"0.926"
"GO:1902855"	"regulation of nonmotile primary cilium assembly"	"0.926"
"GO:0002456"	"T cell mediated immunity"	"0.924"
"GO:0014732"	"skeletal muscle atrophy"	"0.924"
"GO:0006875"	"cellular metal ion homeostasis"	"0.922"
"GO:0007499"	"ectoderm and mesoderm interaction"	"0.922"
"GO:0010481"	"epidermal cell division"	"0.922"
"GO:0060088"	"auditory receptor cell stereocilium organization"	"0.922"
"GO:0051489"	"regulation of filopodium assembly"	"0.92"
"GO:0060806"	"negative regulation of cell differentiation involved in embryonic placenta development"	"0.92"
"GO:0048246"	"macrophage chemotaxis"	"0.917"
"GO:0048593"	"camera-type eye morphogenesis"	"0.917"
"GO:0034242"	"negative regulation of syncytium formation by plasma membrane fusion"	"0.916"
"GO:0006887"	"exocytosis"	"0.915"
"GO:0045818"	"negative regulation of glycogen catabolic process"	"0.915"
"GO:0046631"	"alpha-beta T cell activation"	"0.915"
"GO:0072593"	"reactive oxygen species metabolic process"	"0.915"
"GO:0038066"	"p38MAPK cascade"	"0.914"
"GO:2000279"	"negative regulation of DNA biosynthetic process"	"0.913"
"GO:0032474"	"otolith morphogenesis"	"0.912"
"GO:0051546"	"keratinocyte migration"	"0.912"
"GO:0002508"	"central tolerance induction"	"0.91"
"GO:0002897"	"positive regulation of central B cell tolerance induction"	"0.91"
"GO:0010165"	"response to X-ray"	"0.91"
"GO:0021649"	"vestibulocochlear nerve structural organization"	"0.91"
"GO:0032095"	"regulation of response to food"	"0.91"
"GO:0048762"	"mesenchymal cell differentiation"	"0.91"
"GO:0051601"	"exocyst localization"	"0.91"
"GO:0072016"	"glomerular parietal epithelial cell development"	"0.91"
"GO:0097374"	"sensory neuron axon guidance"	"0.91"
"GO:1901248"	"positive regulation of lung ciliated cell differentiation"	"0.91"
"GO:1904835"	"dorsal root ganglion morphogenesis"	"0.91"
"GO:1905668"	NA	"0.91"
"GO:1990126"	"retrograde transport, endosome to plasma membrane"	"0.91"
"GO:0010273"	"detoxification of copper ion"	"0.909"
"GO:1903214"	"regulation of protein targeting to mitochondrion"	"0.909"
"GO:0014728"	"regulation of the force of skeletal muscle contraction"	"0.908"
"GO:0045917"	"positive regulation of complement activation"	"0.908"
"GO:0071460"	"cellular response to cell-matrix adhesion"	"0.908"
"GO:0003430"	"growth plate cartilage chondrocyte growth"	"0.907"
"GO:0007406"	"negative regulation of neuroblast proliferation"	"0.907"
"GO:0070541"	"response to platinum ion"	"0.907"
"GO:0060193"	"positive regulation of lipase activity"	"0.906"
"GO:0071812"	"positive regulation of fever generation by positive regulation of prostaglandin secretion"	"0.906"
"GO:0071848"	"positive regulation of ERK1 and ERK2 cascade via TNFSF11-mediated signaling"	"0.906"
"GO:0003409"	"optic cup structural organization"	"0.905"
"GO:0006086"	"acetyl-CoA biosynthetic process from pyruvate"	"0.905"
"GO:0051296"	"establishment of meiotic spindle orientation"	"0.905"
"GO:0061035"	"regulation of cartilage development"	"0.905"
"GO:1902103"	"negative regulation of metaphase/anaphase transition of meiotic cell cycle"	"0.905"
"GO:0018192"	"enzyme active site formation via cysteine modification to L-cysteine persulfide"	"0.904"
"GO:0032099"	"negative regulation of appetite"	"0.901"
"GO:0046323"	"glucose import"	"0.901"
"GO:2000822"	"regulation of behavioral fear response"	"0.901"
"GO:0014051"	"gamma-aminobutyric acid secretion"	"0.9"
"GO:1903518"	"positive regulation of single strand break repair"	"0.9"
"GO:0051904"	"pigment granule transport"	"0.899"
"GO:1904290"	"negative regulation of mitotic DNA damage checkpoint"	"0.898"
"GO:0002221"	"pattern recognition receptor signaling pathway"	"0.897"
"GO:0009404"	"toxin metabolic process"	"0.897"
"GO:0014810"	"positive regulation of skeletal muscle contraction by regulation of release of sequestered calcium ion"	"0.896"
"GO:0016331"	"morphogenesis of embryonic epithelium"	"0.896"
"GO:2001023"	"regulation of response to drug"	"0.896"
"GO:0006699"	"bile acid biosynthetic process"	"0.895"
"GO:0008306"	"associative learning"	"0.895"
"GO:0033604"	"negative regulation of catecholamine secretion"	"0.895"
"GO:0060684"	"epithelial-mesenchymal cell signaling"	"0.895"
"GO:0006750"	"glutathione biosynthetic process"	"0.894"
"GO:0042701"	"progesterone secretion"	"0.894"
"GO:0035988"	"chondrocyte proliferation"	"0.893"
"GO:1903292"	"protein localization to Golgi membrane"	"0.892"
"GO:0042297"	"vocal learning"	"0.891"
"GO:0045793"	"positive regulation of cell size"	"0.89"
"GO:0003136"	"negative regulation of heart induction by canonical Wnt signaling pathway"	"0.889"
"GO:0008210"	"estrogen metabolic process"	"0.889"
"GO:0021874"	"Wnt signaling pathway involved in forebrain neuroblast division"	"0.889"
"GO:0048337"	"positive regulation of mesodermal cell fate specification"	"0.889"
"GO:0051186"	"cofactor metabolic process"	"0.889"
"GO:0090676"	"calcium ion transmembrane transport via low voltage-gated calcium channel"	"0.889"
"GO:1903829"	"positive regulation of cellular protein localization"	"0.889"
"GO:2000081"	"positive regulation of canonical Wnt signaling pathway involved in controlling type B pancreatic cell proliferation"	"0.889"
"GO:0032962"	"positive regulation of inositol trisphosphate biosynthetic process"	"0.888"
"GO:0070537"	"histone H2A K63-linked deubiquitination"	"0.888"
"GO:0071397"	"cellular response to cholesterol"	"0.888"
"GO:0050859"	"negative regulation of B cell receptor signaling pathway"	"0.886"
"GO:1904172"	"positive regulation of bleb assembly"	"0.886"
"GO:1901698"	"response to nitrogen compound"	"0.885"
"GO:1904880"	"response to hydrogen sulfide"	"0.885"
"GO:1904871"	"positive regulation of protein localization to Cajal body"	"0.884"
"GO:1904674"	"positive regulation of somatic stem cell population maintenance"	"0.883"
"GO:0030200"	"heparan sulfate proteoglycan catabolic process"	"0.882"
"GO:0099551"	"trans-synaptic signaling by neuropeptide, modulating synaptic transmission"	"0.881"
"GO:0032848"	"negative regulation of cellular pH reduction"	"0.88"
"GO:0043375"	"CD8-positive, alpha-beta T cell lineage commitment"	"0.88"
"GO:0046671"	"negative regulation of retinal cell programmed cell death"	"0.88"
"GO:0048753"	"pigment granule organization"	"0.88"
"GO:0010975"	"regulation of neuron projection development"	"0.878"
"GO:0032957"	"inositol trisphosphate metabolic process"	"0.878"
"GO:0045923"	"positive regulation of fatty acid metabolic process"	"0.878"
"GO:0071109"	"superior temporal gyrus development"	"0.878"
"GO:0030182"	"neuron differentiation"	"0.877"
"GO:0051151"	"negative regulation of smooth muscle cell differentiation"	"0.876"
"GO:0072190"	"ureter urothelium development"	"0.875"
"GO:1903285"	"positive regulation of hydrogen peroxide catabolic process"	"0.875"
"GO:0003056"	"regulation of vascular smooth muscle contraction"	"0.874"
"GO:0046010"	"positive regulation of circadian sleep/wake cycle, non-REM sleep"	"0.874"
"GO:0045055"	"regulated exocytosis"	"0.873"
"GO:0030178"	"negative regulation of Wnt signaling pathway"	"0.872"
"GO:0051567"	"histone H3-K9 methylation"	"0.872"
"GO:0035732"	"nitric oxide storage"	"0.87"
"GO:0061743"	"motor learning"	"0.87"
"GO:0065004"	"protein-DNA complex assembly"	"0.87"
"GO:0006286"	"base-excision repair, base-free sugar-phosphate removal"	"0.869"
"GO:0035377"	"transepithelial water transport"	"0.869"
"GO:0046016"	"positive regulation of transcription by glucose"	"0.869"
"GO:0046459"	"short-chain fatty acid metabolic process"	"0.869"
"GO:0006582"	"melanin metabolic process"	"0.866"
"GO:0035360"	"positive regulation of peroxisome proliferator activated receptor signaling pathway"	"0.866"
"GO:0043170"	"macromolecule metabolic process"	"0.866"
"GO:0071384"	"cellular response to corticosteroid stimulus"	"0.866"
"GO:1900053"	"negative regulation of retinoic acid biosynthetic process"	"0.866"
"GO:2000224"	"regulation of testosterone biosynthetic process"	"0.866"
"GO:0019882"	"antigen processing and presentation"	"0.865"
"GO:0035269"	"protein O-linked mannosylation"	"0.865"
"GO:0140009"	NA	"0.864"
"GO:0099131"	NA	"0.863"
"GO:1904044"	"response to aldosterone"	"0.863"
"GO:0002651"	"positive regulation of tolerance induction to self antigen"	"0.862"
"GO:0002663"	"positive regulation of B cell tolerance induction"	"0.862"
"GO:0043009"	"chordate embryonic development"	"0.862"
"GO:1905315"	"cell proliferation involved in endocardial cushion morphogenesis"	"0.862"
"GO:1905316"	"superior endocardial cushion morphogenesis"	"0.862"
"GO:1905317"	"inferior endocardial cushion morphogenesis"	"0.862"
"GO:0043266"	"regulation of potassium ion transport"	"0.861"
"GO:0030219"	"megakaryocyte differentiation"	"0.86"
"GO:1903999"	"negative regulation of eating behavior"	"0.86"
"GO:0001842"	"neural fold formation"	"0.858"
"GO:0019089"	"transmission of virus"	"0.858"
"GO:0035307"	"positive regulation of protein dephosphorylation"	"0.858"
"GO:0044111"	"development involved in symbiotic interaction"	"0.858"
"GO:0046824"	"positive regulation of nucleocytoplasmic transport"	"0.858"
"GO:0071279"	"cellular response to cobalt ion"	"0.858"
"GO:2000454"	"positive regulation of CD8-positive, alpha-beta cytotoxic T cell extravasation"	"0.858"
"GO:0033685"	"negative regulation of luteinizing hormone secretion"	"0.856"
"GO:0070664"	"negative regulation of leukocyte proliferation"	"0.856"
"GO:0034629"	"cellular protein complex localization"	"0.853"
"GO:0071774"	"response to fibroblast growth factor"	"0.853"
"GO:0090042"	"tubulin deacetylation"	"0.853"
"GO:0040008"	"regulation of growth"	"0.85"
"GO:2000824"	"negative regulation of androgen receptor activity"	"0.85"
"GO:0003400"	"regulation of COPII vesicle coating"	"0.849"
"GO:1900116"	"extracellular negative regulation of signal transduction"	"0.849"
"GO:0035385"	"Roundabout signaling pathway"	"0.846"
"GO:0036475"	"neuron death in response to oxidative stress"	"0.846"
"GO:0043297"	"apical junction assembly"	"0.846"
"GO:0071395"	"cellular response to jasmonic acid stimulus"	"0.846"
"GO:0021623"	"oculomotor nerve formation"	"0.845"
"GO:0036003"	"positive regulation of transcription from RNA polymerase II promoter in response to stress"	"0.845"
"GO:0046135"	"pyrimidine nucleoside catabolic process"	"0.845"
"GO:0007253"	"cytoplasmic sequestering of NF-kappaB"	"0.844"
"GO:0010585"	"glutamine secretion"	"0.844"
"GO:0031339"	"negative regulation of vesicle fusion"	"0.844"
"GO:1903803"	"L-glutamine import into cell"	"0.844"
"GO:0010155"	"regulation of proton transport"	"0.843"
"GO:0019079"	"viral genome replication"	"0.842"
"GO:0043281"	"regulation of cysteine-type endopeptidase activity involved in apoptotic process"	"0.841"
"GO:1904031"	"positive regulation of cyclin-dependent protein kinase activity"	"0.841"
"GO:0030029"	"actin filament-based process"	"0.84"
"GO:0043610"	"regulation of carbohydrate utilization"	"0.84"
"GO:0045409"	"negative regulation of interleukin-6 biosynthetic process"	"0.84"
"GO:0099547"	"regulation of translation at synapse, modulating synaptic transmission"	"0.84"
"GO:1904056"	"positive regulation of cholangiocyte proliferation"	"0.84"
"GO:1904193"	"negative regulation of cholangiocyte apoptotic process"	"0.84"
"GO:1904197"	"positive regulation of granulosa cell proliferation"	"0.84"
"GO:1904206"	"positive regulation of skeletal muscle hypertrophy"	"0.84"
"GO:1904213"	"negative regulation of iodide transmembrane transport"	"0.84"
"GO:1904690"	"positive regulation of cytoplasmic translational initiation"	"0.84"
"GO:0006430"	"lysyl-tRNA aminoacylation"	"0.839"
"GO:0050909"	"sensory perception of taste"	"0.839"
"GO:0007207"	"phospholipase C-activating G-protein coupled acetylcholine receptor signaling pathway"	"0.837"
"GO:0008637"	"apoptotic mitochondrial changes"	"0.837"
"GO:1904640"	"response to methionine"	"0.837"
"GO:0002828"	"regulation of type 2 immune response"	"0.836"
"GO:0006103"	"2-oxoglutarate metabolic process"	"0.836"
"GO:0010957"	"negative regulation of vitamin D biosynthetic process"	"0.836"
"GO:0031503"	"protein complex localization"	"0.836"
"GO:0050428"	"3'-phosphoadenosine 5'-phosphosulfate biosynthetic process"	"0.836"
"GO:1990575"	"mitochondrial L-ornithine transmembrane transport"	"0.836"
"GO:0003418"	"growth plate cartilage chondrocyte differentiation"	"0.835"
"GO:0010032"	"meiotic chromosome condensation"	"0.835"
"GO:0060197"	"cloacal septation"	"0.834"
"GO:0006868"	"glutamine transport"	"0.832"
"GO:0051252"	"regulation of RNA metabolic process"	"0.832"
"GO:0097499"	"protein localization to nonmotile primary cilium"	"0.832"
"GO:1904016"	"response to Thyroglobulin triiodothyronine"	"0.832"
"GO:0002276"	"basophil activation involved in immune response"	"0.831"
"GO:0000060"	"protein import into nucleus, translocation"	"0.83"
"GO:0045022"	"early endosome to late endosome transport"	"0.83"
"GO:0017157"	"regulation of exocytosis"	"0.829"
"GO:0071871"	"response to epinephrine"	"0.828"
"GO:0072044"	"collecting duct development"	"0.828"
"GO:0007493"	"endodermal cell fate determination"	"0.826"
"GO:0001696"	"gastric acid secretion"	"0.822"
"GO:0034201"	"response to oleic acid"	"0.822"
"GO:0001706"	"endoderm formation"	"0.82"
"GO:0015697"	"quaternary ammonium group transport"	"0.82"
"GO:0045475"	"locomotor rhythm"	"0.82"
"GO:0007005"	"mitochondrion organization"	"0.819"
"GO:0048739"	"cardiac muscle fiber development"	"0.819"
"GO:0045823"	"positive regulation of heart contraction"	"0.818"
"GO:0060285"	"cilium-dependent cell motility"	"0.818"
"GO:0019062"	"virion attachment to host cell"	"0.816"
"GO:0051965"	"positive regulation of synapse assembly"	"0.816"
"GO:0072010"	"glomerular epithelium development"	"0.815"
"GO:1901534"	"positive regulation of hematopoietic progenitor cell differentiation"	"0.815"
"GO:1902038"	"positive regulation of hematopoietic stem cell differentiation"	"0.815"
"GO:1902811"	"positive regulation of skeletal muscle fiber differentiation"	"0.815"
"GO:1905870"	NA	"0.815"
"GO:0000281"	"mitotic cytokinesis"	"0.814"
"GO:0002062"	"chondrocyte differentiation"	"0.813"
"GO:0006264"	"mitochondrial DNA replication"	"0.813"
"GO:0036289"	"peptidyl-serine autophosphorylation"	"0.812"
"GO:0072674"	"multinuclear osteoclast differentiation"	"0.812"
"GO:0003253"	"cardiac neural crest cell migration involved in outflow tract morphogenesis"	"0.811"
